{
  "as_of": "2026-07-01",
  "current_regime": "Slowdown",
  "forecasts": {
    "3m": {
      "x": 101.3156,
      "y": 98.5367,
      "quadrant": "Slowdown",
      "conviction": 72.4
    },
    "6m": {
      "x": 100.8414,
      "y": 98.457,
      "quadrant": "Slowdown",
      "conviction": 63.4
    },
    "9m": {
      "x": 100.3992,
      "y": 98.5316,
      "quadrant": "Slowdown",
      "conviction": 36.4
    }
  },
  "signal_contributions": {
    "momentum": {
      "x": 100.9143,
      "y": 98.3014
    },
    "analogues": {
      "x": 99.6346,
      "y": 98.7163
    },
    "macro_drivers": {
      "x": 100.6458,
      "y": 98.6414
    }
  },
  "conviction": 63.4,
  "model_version": "2.5",
  "data_health": {
    "US CLI (OECD)": {
      "value": 100.8,
      "release_date": "Jun 2026",
      "source": "FRED (Cached)",
      "last_updated": "N/A",
      "cache_status": "[DELAYED] Delayed"
    }
  },
  "projected_path": [
    [
      101.87691981776045,
      99.0808826789141
    ],
    [
      101.65841290231751,
      98.87932639328208
    ],
    [
      101.48486708217442,
      98.67630609837249
    ],
    [
      101.31561475610434,
      98.53668863043603
    ],
    [
      101.15043675541617,
      98.45324525809751
    ],
    [
      100.99318383456219,
      98.44560630489289
    ],
    [
      100.84139926391309,
      98.45696582571256
    ],
    [
      100.69168068295939,
      98.46922082801794
    ],
    [
      100.54590473232133,
      98.50519830491771
    ],
    [
      100.39924116335244,
      98.53163478529694
    ]
  ],
  "confidence_band": {
    "inner": [
      {
        "x": 101.87691981776045,
        "y": 99.0808826789141,
        "dx": 0.05617100755104803,
        "dy": 0.21182622732976036
      },
      {
        "x": 101.65841290231751,
        "y": 98.87932639328208,
        "dx": 0.05617100755104803,
        "dy": 0.21182622732976036
      },
      {
        "x": 101.48486708217442,
        "y": 98.67630609837249,
        "dx": 0.07943780069085365,
        "dy": 0.29956752355607347
      },
      {
        "x": 101.31561475610434,
        "y": 98.53668863043603,
        "dx": 0.09729103899075024,
        "dy": 0.36689378811078
      },
      {
        "x": 101.15043675541617,
        "y": 98.45324525809751,
        "dx": 0.11234201510209606,
        "dy": 0.4236524546595207
      },
      {
        "x": 100.99318383456219,
        "y": 98.44560630489289,
        "dx": 0.1256021912487974,
        "dy": 0.4736578437266679
      },
      {
        "x": 100.84139926391309,
        "y": 98.45696582571256,
        "dx": 0.13759030683808857,
        "dy": 0.5188661710967056
      },
      {
        "x": 100.69168068295939,
        "y": 98.46922082801794,
        "dx": 0.14861451687200436,
        "dy": 0.5604395186755794
      },
      {
        "x": 100.54590473232133,
        "y": 98.50519830491771,
        "dx": 0.1588756013817073,
        "dy": 0.5991350471121469
      },
      {
        "x": 100.39924116335244,
        "y": 98.53163478529694,
        "dx": 0.16851302265314408,
        "dy": 0.635478681989281
      }
    ],
    "outer": [
      {
        "x": 101.87691981776045,
        "y": 99.0808826789141,
        "dx": 0.10731177561991265,
        "dy": 0.4046829417643183
      },
      {
        "x": 101.65841290231751,
        "y": 98.87932639328208,
        "dx": 0.10731177561991265,
        "dy": 0.4046829417643183
      },
      {
        "x": 101.48486708217442,
        "y": 98.67630609837249,
        "dx": 0.15176176848401893,
        "dy": 0.5723081047041404
      },
      {
        "x": 101.31561475610434,
        "y": 98.53668863043603,
        "dx": 0.18586944762411986,
        "dy": 0.7009314160922364
      },
      {
        "x": 101.15043675541617,
        "y": 98.45324525809751,
        "dx": 0.2146235512398253,
        "dy": 0.8093658835286366
      },
      {
        "x": 100.99318383456219,
        "y": 98.44560630489289,
        "dx": 0.23995642507232934,
        "dy": 0.9048985671196043
      },
      {
        "x": 100.84139926391309,
        "y": 98.45696582571256,
        "dx": 0.26285909366082594,
        "dy": 0.9912667149310197
      },
      {
        "x": 100.69168068295939,
        "y": 98.46922082801794,
        "dx": 0.2839202710390531,
        "dy": 1.0706904237384205
      },
      {
        "x": 100.54590473232133,
        "y": 98.50519830491771,
        "dx": 0.30352353696803785,
        "dy": 1.1446162094082808
      },
      {
        "x": 100.39924116335244,
        "y": 98.53163478529694,
        "dx": 0.3219353268597379,
        "dy": 1.2140488252929549
      }
    ]
  },
  "residual_std": {
    "x": 0.08383732470305676,
    "y": 0.31615854825337364
  }
}