{
  "as_of": "2026-07-01",
  "current_regime": "Slowdown",
  "forecasts": {
    "3m": {
      "x": 100.9722,
      "y": 97.8606,
      "quadrant": "Slowdown",
      "conviction": 71.2
    },
    "6m": {
      "x": 100.4582,
      "y": 97.8384,
      "quadrant": "Slowdown",
      "conviction": 44.2
    },
    "9m": {
      "x": 100.0492,
      "y": 98.1327,
      "quadrant": "Slowdown",
      "conviction": 35.2
    }
  },
  "signal_contributions": {
    "momentum": {
      "x": 100.7689,
      "y": 97.3932
    },
    "analogues": {
      "x": 99.2123,
      "y": 99.0392
    },
    "macro_drivers": {
      "x": 100.0692,
      "y": 98.0466
    }
  },
  "conviction": 44.2,
  "model_version": "2.5",
  "data_health": {
    "India CLI (OECD)": {
      "value": 101.25,
      "release_date": "Jun 2026",
      "source": "FRED (Offline Bundled)",
      "last_updated": "N/A",
      "cache_status": "Offline [OK]"
    }
  },
  "projected_path": [
    [
      101.69368556544184,
      98.40063884780987
    ],
    [
      101.34051517059298,
      98.19074826927682
    ],
    [
      101.15430629510634,
      97.98363929797688
    ],
    [
      100.97217845478903,
      97.86063515227978
    ],
    [
      100.79458733143177,
      97.80533013129826
    ],
    [
      100.62249202584043,
      97.80107069524077
    ],
    [
      100.4581564076519,
      97.83836806669635
    ],
    [
      100.3051458227073,
      97.9106391095755
    ],
    [
      100.16741422056376,
      98.0102479977166
    ],
    [
      100.04917214448272,
      98.13266915377093
    ]
  ],
  "confidence_band": {
    "inner": [
      {
        "x": 101.69368556544184,
        "y": 98.40063884780987,
        "dx": 0.12157830233219263,
        "dy": 0.10673889691789774
      },
      {
        "x": 101.34051517059298,
        "y": 98.19074826927682,
        "dx": 0.12157830233219263,
        "dy": 0.10673889691789774
      },
      {
        "x": 101.15430629510634,
        "y": 97.98363929797688,
        "dx": 0.1719376840484833,
        "dy": 0.15095159565403476
      },
      {
        "x": 100.97217845478903,
        "y": 97.86063515227978,
        "dx": 0.21057979673732735,
        "dy": 0.1848771926056559
      },
      {
        "x": 100.79458733143177,
        "y": 97.80533013129826,
        "dx": 0.24315660466438527,
        "dy": 0.2134777938357955
      },
      {
        "x": 100.62249202584043,
        "y": 97.80107069524077,
        "dx": 0.27185734860380395,
        "dy": 0.23867542935176214
      },
      {
        "x": 100.4581564076519,
        "y": 97.83836806669635,
        "dx": 0.297804804507698,
        "dy": 0.2614558331563815
      },
      {
        "x": 100.3051458227073,
        "y": 97.9106391095755,
        "dx": 0.32166595279240584,
        "dy": 0.28240457646211614
      },
      {
        "x": 100.16741422056376,
        "y": 98.0102479977166,
        "dx": 0.3438753680969666,
        "dy": 0.30190319130806953
      },
      {
        "x": 100.04917214448272,
        "y": 98.13266915377093,
        "dx": 0.3647349069965779,
        "dy": 0.3202166907536932
      }
    ],
    "outer": [
      {
        "x": 101.69368556544184,
        "y": 98.40063884780987,
        "dx": 0.2322689955003083,
        "dy": 0.20391908664911806
      },
      {
        "x": 101.34051517059298,
        "y": 98.19074826927682,
        "dx": 0.2322689955003083,
        "dy": 0.20391908664911806
      },
      {
        "x": 101.15430629510634,
        "y": 97.98363929797688,
        "dx": 0.3284779635553114,
        "dy": 0.28838513796591714
      },
      {
        "x": 100.97217845478903,
        "y": 97.86063515227978,
        "dx": 0.4023017012295209,
        "dy": 0.3531982187093128
      },
      {
        "x": 100.79458733143177,
        "y": 97.80533013129826,
        "dx": 0.4645379910006166,
        "dy": 0.40783817329823613
      },
      {
        "x": 100.62249202584043,
        "y": 97.80107069524077,
        "dx": 0.5193692630042821,
        "dy": 0.4559769396570978
      },
      {
        "x": 100.4581564076519,
        "y": 97.83836806669635,
        "dx": 0.5689405220445573,
        "dy": 0.49949771110472874
      },
      {
        "x": 100.3051458227073,
        "y": 97.9106391095755,
        "dx": 0.6145259993645962,
        "dy": 0.539519190852998
      },
      {
        "x": 100.16741422056376,
        "y": 98.0102479977166,
        "dx": 0.6569559271106228,
        "dy": 0.5767702759318343
      },
      {
        "x": 100.04917214448272,
        "y": 98.13266915377093,
        "dx": 0.696806986500925,
        "dy": 0.6117572599473542
      }
    ]
  },
  "residual_std": {
    "x": 0.18146015273461585,
    "y": 0.1593117864446235
  }
}